{
  "key": "inno-setup",
  "short_name": "Inno Setup License",
  "name": "Inno Setup License",
  "category": "Permissive",
  "owner": "jrsoftware.org",
  "homepage_url": "http://www.jrsoftware.org/files/is/license.txt",
  "spdx_license_key": "InnoSetup",
  "other_spdx_license_keys": [
    "LicenseRef-scancode-inno-setup"
  ],
  "text_urls": [
    "http://www.jrsoftware.org/files/is/license.txt"
  ],
  "ignorable_copyrights": [
    "Copyright (c) 1997-2010 Jordan Russell",
    "Portions Copyright (c) 2000-2010 Martijn Laan",
    "copyrighted by Jordan Russell"
  ],
  "ignorable_holders": [
    "Jordan Russell",
    "Martijn Laan"
  ],
  "ignorable_urls": [
    "http://www.jrsoftware.org/"
  ],
  "text": "Inno Setup License\n==================\n\nExcept where otherwise noted, all of the documentation and software included\nin the Inno Setup package is copyrighted by Jordan Russell.\n\nCopyright (C) 1997-2010 Jordan Russell. All rights reserved.\nPortions Copyright (C) 2000-2010 Martijn Laan. All rights reserved.\n\nThis software is provided \"as-is,\" without any express or implied warranty.\nIn no event shall the author be held liable for any damages arising from the\nuse of this software.\n\nPermission is granted to anyone to use this software for any purpose,\nincluding commercial applications, and to alter and redistribute it,\nprovided that the following conditions are met:\n\n1. All redistributions of source code files must retain all copyright\n   notices that are currently in place, and this list of conditions without\n   modification.\n\n2. All redistributions in binary form must retain all occurrences of the\n   above copyright notice and web site addresses that are currently in\n   place (for example, in the About boxes).\n\n3. The origin of this software must not be misrepresented; you must not\n   claim that you wrote the original software. If you use this software to\n   distribute a product, an acknowledgment in the product documentation\n   would be appreciated but is not required.\n\n4. Modified versions in source or binary form must be plainly marked as\n   such, and must not be misrepresented as being the original software.\n\n\nJordan Russell\njr-2010 AT jrsoftware.org\nhttp://www.jrsoftware.org/"
}