{
  "key": "libpng",
  "short_name": "Libpng License",
  "name": "Libpng License",
  "category": "Permissive",
  "owner": "libpng",
  "homepage_url": "http://www.libpng.org/pub/png/libpng.html",
  "spdx_license_key": "Libpng",
  "text_urls": [
    "http://libpng.org/pub/png/src/libpng-LICENSE.txt"
  ],
  "other_urls": [
    "http://www.libpng.org/pub/png/src/libpng-LICENSE.txt"
  ],
  "ignorable_copyrights": [
    "Copyright (c) 1995, 1996 Guy Eric Schalnat, Group 42, Inc.",
    "Copyright (c) 1996, 1997 Andreas Dilger Distributed",
    "Copyright (c) 1998, 1999 Glenn Randers-Pehrson",
    "Copyright (c) 2000-2002 Glenn Randers-Pehrson",
    "Copyright (c) 2004, 2006-2008 Glenn Randers-Pehrson"
  ],
  "ignorable_holders": [
    "Andreas Dilger Distributed",
    "Glenn Randers-Pehrson",
    "Guy Eric Schalnat, Group 42, Inc."
  ],
  "text": "This copy of the libpng notices is provided for your convenience.  In case of\nany discrepancy between this copy and the notices in the file png.h that is\nincluded in the libpng distribution, the latter shall prevail.\n\nCOPYRIGHT NOTICE, DISCLAIMER, and LICENSE:\n\nIf you modify libpng you may insert additional notices immediately following\nthis sentence.\n\nlibpng versions 1.2.6, August 15, 2004, through 1.2.33, October 31, 2008, are\nCopyright (c) 2004, 2006-2008 Glenn Randers-Pehrson, and are\ndistributed according to the same disclaimer and license as libpng-1.2.5\nwith the following individual added to the list of Contributing Authors\n\n   Cosmin Truta\n\nlibpng versions 1.0.7, July 1, 2000, through 1.2.5 - October 3, 2002, are\nCopyright (c) 2000-2002 Glenn Randers-Pehrson, and are\ndistributed according to the same disclaimer and license as libpng-1.0.6\nwith the following individuals added to the list of Contributing Authors\n\n   Simon-Pierre Cadieux\n   Eric S. Raymond\n   Gilles Vollant\n\nand with the following additions to the disclaimer:\n\n   There is no warranty against interference with your enjoyment of the\n   library or against infringement.  There is no warranty that our\n   efforts or the library will fulfill any of your particular purposes\n   or needs.  This library is provided with all faults, and the entire\n   risk of satisfactory quality, performance, accuracy, and effort is with\n   the user.\n\nlibpng versions 0.97, January 1998, through 1.0.6, March 20, 2000, are\nCopyright (c) 1998, 1999 Glenn Randers-Pehrson, and are\ndistributed according to the same disclaimer and license as libpng-0.96,\nwith the following individuals added to the list of Contributing Authors:\n\n   Tom Lane\n   Glenn Randers-Pehrson\n   Willem van Schaik\n\nlibpng versions 0.89, June 1996, through 0.96, May 1997, are\nCopyright (c) 1996, 1997 Andreas Dilger\nDistributed according to the same disclaimer and license as libpng-0.88,\nwith the following individuals added to the list of Contributing Authors:\n\n   John Bowler\n   Kevin Bracey\n   Sam Bushell\n   Magnus Holmgren\n   Greg Roelofs\n   Tom Tanner\n\nlibpng versions 0.5, May 1995, through 0.88, January 1996, are\nCopyright (c) 1995, 1996 Guy Eric Schalnat, Group 42, Inc.\n\nFor the purposes of this copyright and license, \"Contributing Authors\"\nis defined as the following set of individuals:\n\n   Andreas Dilger\n   Dave Martindale\n   Guy Eric Schalnat\n   Paul Schmidt\n   Tim Wegner\n\nThe PNG Reference Library is supplied \"AS IS\".  The Contributing Authors\nand Group 42, Inc. disclaim all warranties, expressed or implied,\nincluding, without limitation, the warranties of merchantability and of\nfitness for any purpose.  The Contributing Authors and Group 42, Inc.\nassume no liability for direct, indirect, incidental, special, exemplary,\nor consequential damages, which may result from the use of the PNG\nReference Library, even if advised of the possibility of such damage.\n\nPermission is hereby granted to use, copy, modify, and distribute this\nsource code, or portions hereof, for any purpose, without fee, subject\nto the following restrictions:\n\n1. The origin of this source code must not be misrepresented.\n\n2. Altered versions must be plainly marked as such and must not\n   be misrepresented as being the original source.\n\n3. This Copyright notice may not be removed or altered from any\n   source or altered source distribution.\n\nThe Contributing Authors and Group 42, Inc. specifically permit, without\nfee, and encourage the use of this source code as a component to\nsupporting the PNG file format in commercial products.  If you use this\nsource code in a product, acknowledgment is not required but would be\nappreciated.\n\n\nA \"png_get_copyright\" function is available, for convenient use in \"about\"\nboxes and the like:\n\n   printf(\"%s\",png_get_copyright(NULL));\n\nAlso, the PNG logo (in PNG format, of course) is supplied in the\nfiles \"pngbar.png\" and \"pngbar.jpg (88x31) and \"pngnow.png\" (98x31).\n\nLibpng is OSI Certified Open Source Software.  OSI Certified Open Source is a\ncertification mark of the Open Source Initiative.\n\nGlenn Randers-Pehrson\nglennrp at users.sourceforge.net\nOctober 31, 2008"
}