{
  "key": "net-snmp",
  "short_name": "Net SNMP License",
  "name": "Net SNMP License",
  "category": "Permissive",
  "owner": "Net-SNMP",
  "homepage_url": "http://net-snmp.sourceforge.net/about/license.html",
  "notes": "composite",
  "spdx_license_key": "Net-SNMP",
  "minimum_coverage": 70,
  "ignorable_copyrights": [
    "Copyright (c) 2001-2003, Networks Associates Technology, Inc",
    "Copyright (c) 2003 Sun Microsystems, Inc., 4150 Network Circle, Santa Clara, California 95054, U.S.A.",
    "Copyright (c) 2003-2006, Sparta, Inc",
    "Copyright (c) 2004, Cisco, Inc and Information Network Center of Beijing University of Posts and Telecommunications",
    "Copyright (c) Fabasoft R&D Software GmbH & Co",
    "Copyright 1989, 1991, 1992 by Carnegie Mellon University",
    "Copyright 1996, 1998-2000 The Regents of the University of California",
    "copyright (c) 2001-2003, Cambridge Broadband Ltd."
  ],
  "ignorable_holders": [
    "Cambridge Broadband Ltd.",
    "Carnegie Mellon University",
    "Cisco, Inc and Information Network Center of Beijing University of Posts and Telecommunications",
    "Fabasoft R&D Software GmbH & Co",
    "Networks Associates Technology, Inc",
    "Sparta, Inc",
    "Sun Microsystems, Inc., 4150 Network Circle, Santa Clara, California 95054, U.S.A.",
    "The Regents of the University of California"
  ],
  "ignorable_authors": [
    "Bernhard Penz"
  ],
  "ignorable_urls": [
    "http://net-snmp.sourceforge.net/about/license.html"
  ],
  "ignorable_emails": [
    "oss@fabasoft.com"
  ],
  "text": "Net SNMP License\nhttp://net-snmp.sourceforge.net/about/license.html \n\nVarious copyrights apply to this package, listed in various separate parts \nbelow.  Please make sure that you read all the parts.  Up until 2001, the \nproject was based at UC Davis, and the first part covers all code written \nduring this time.  From 2001 onwards, the project has been based at \nSourceForge, and Networks Associates Technology, Inc hold the copyright on \nbehalf of the wider Net-SNMP community, covering all derivative work done \nsince then.  An additional copyright section has been added as Part 3 below \nalso under a BSD license for the work contributed by Cambridge Broadband Ltd. \nto the project since 2001.\n\nAn additional copyright section has been added as Part 4 below also under a \nBSD license for the work contributed by Sun Microsystems, Inc. to the project \nsince 2003. \n \nCode has been contributed to this project by many people over the years it \nhas been in development, and a full list of contributors can be found in the \nREADME file under the THANKS section. \n \n---- Part 1: CMU/UCD copyright notice: (BSD like) ----- \n \n \n       Copyright 1989, 1991, 1992 by Carnegie Mellon University \n \n    Derivative Work - 1996, 1998-2000 \nCopyright 1996, 1998-2000 The Regents of the University of California \n \n    All Rights Reserved \n \nPermission to use, copy, modify and distribute this software and its \ndocumentation for any purpose and without fee is hereby granted, provided \nthat the above copyright notice appears in all copies and that both that \ncopyright notice and this permission notice appear in \nsupporting documentation, and that the name of CMU and The Regents of the \nUniversity of California not be used in advertising or publicity pertaining \nto distribution of the software without specific written permission. \n \nCMU AND THE REGENTS OF THE UNIVERSITY OF CALIFORNIA DISCLAIM ALL WARRANTIES \nWITH REGARD TO THIS SOFTWARE, INCLUDING ALL IMPLIED WARRANTIES OF \nMERCHANTABILITY AND FITNESS.  IN NO EVENT SHALL CMU OR \nTHE REGENTS OF THE UNIVERSITY OF CALIFORNIA BE LIABLE FOR ANY SPECIAL, \nINDIRECT OR CONSEQUENTIAL DAMAGES OR ANY DAMAGES WHATSOEVER RESULTING \nFROM THE LOSS OF USE, DATA OR PROFITS, WHETHER IN AN ACTION OF CONTRACT, \nNEGLIGENCE OR OTHER TORTIOUS ACTION, ARISING OUT OF OR IN CONNECTION WITH THE \nUSE OR PERFORMANCE OF THIS SOFTWARE. \n \nPart 2: Networks Associates Technology, Inc copyright notice (BSD)  \n \nCopyright (c) 2001-2003, Networks Associates Technology, Inc \nAll rights reserved. \n  \nRedistribution and use in source and binary forms, with or without \nmodification, are permitted provided that the following conditions are met: \n  \nRedistributions of source code must retain the above copyright notice, \nthis list of conditions and the following disclaimer. \n  \nRedistributions in binary form must reproduce the above copyright notice, \nthis list of conditions and the following disclaimer in the documentation \nand/or other materials provided with the distribution. \n  \nNeither the name of the Networks Associates Technology, Inc nor the names of \nits contributors may be used to endorse or promote products derived from this \nsoftware without specific prior written permission. \n  \nTHIS SOFTWARE IS PROVIDED BY THE COPYRIGHT HOLDERS AND CONTRIBUTORS ``AS IS'' \nAND ANY EXPRESS OR IMPLIED WARRANTIES, INCLUDING, BUT NOT LIMITED TO, THE \nIMPLIED WARRANTIES OF MERCHANTABILITY AND FITNESS FOR A PARTICULAR PURPOSE \nARE DISCLAIMED.  IN NO EVENT SHALL THE COPYRIGHT HOLDERS OR CONTRIBUTORS BE \nLIABLE FOR ANY DIRECT, INDIRECT, INCIDENTAL, SPECIAL, EXEMPLARY, OR \nCONSEQUENTIAL DAMAGES (INCLUDING, BUT NOT LIMITED TO, PROCUREMENT OF \nSUBSTITUTE GOODS OR SERVICES; LOSS OF USE, DATA, OR PROFITS; OR BUSINESS \nINTERRUPTION) HOWEVER CAUSED AND ON ANY THEORY OF LIABILITY, WHETHER IN \nCONTRACT, STRICT LIABILITY, OR TORT (INCLUDING NEGLIGENCE OR OTHERWISE) \nARISING IN ANY WAY OUT OF THE USE OF THIS SOFTWARE, EVEN IF ADVISED OF THE \nPOSSIBILITY OF SUCH DAMAGE. \n \n---- Part 3: Cambridge Broadband Ltd. copyright notice (BSD) ----- \n \nPortions of this code are copyright (c) 2001-2003, Cambridge Broadband Ltd. \nAll rights reserved. \n  \nRedistribution and use in source and binary forms, with or without \nmodification, are permitted provided that the following conditions are met: \n  \nRedistributions of source code must retain the above copyright notice, his \nlist of conditions and the following disclaimer. \n  \nRedistributions in binary form must reproduce the above copyright notice, \nthis list of conditions and the following disclaimer in the    documentation \nand/or other materials provided with the distribution. \n  \nThe name of Cambridge Broadband Ltd. may not be used to endorse or   promote \nproducts derived from this software without specific prior   written \npermission. \n  \nTHIS SOFTWARE IS PROVIDED BY THE COPYRIGHT HOLDER ``AS IS'' AND ANY \nEXPRESS OR IMPLIED WARRANTIES, INCLUDING, BUT NOT LIMITED TO, THE \nIMPLIED WARRANTIES OF MERCHANTABILITY AND FITNESS FOR A PARTICULAR \nPURPOSE ARE DISCLAIMED.  IN NO EVENT SHALL THE COPYRIGHT HOLDER BE \nLIABLE FOR ANY DIRECT, INDIRECT, INCIDENTAL, SPECIAL, EXEMPLARY, OR \nCONSEQUENTIAL DAMAGES (INCLUDING, BUT NOT LIMITED TO, PROCUREMENT OF \nSUBSTITUTE GOODS OR SERVICES; LOSS OF USE, DATA, OR PROFITS; OR \nBUSINESS INTERRUPTION) HOWEVER CAUSED AND ON ANY THEORY OF LIABILITY, \nWHETHER IN CONTRACT, STRICT LIABILITY, OR TORT (INCLUDING NEGLIGENCE \nOR OTHERWISE) ARISING IN ANY WAY OUT OF THE USE OF THIS SOFTWARE, EVEN \nIF ADVISED OF THE POSSIBILITY OF SUCH DAMAGE. \n \n---- Part 4: Sun Microsystems, Inc. copyright notice (BSD) ----- \n \nCopyright \u00a9 2003 Sun Microsystems, Inc., 4150 Network Circle, Santa Clara, \nCalifornia 95054, U.S.A. All rights reserved. \n \nUse is subject to license terms below. \n \nThis distribution may include materials developed by third parties. \n \nSun, Sun Microsystems, the Sun logo and Solaris are trademarks or registered \ntrademarks of Sun Microsystems, Inc. in the U.S. and other countries. \n \nRedistribution and use in source and binary forms, with or without \nmodification, are permitted provided that the following conditions are met: \n \nRedistributions of source code must retain the above copyright notice, this \nlist of conditions and the following disclaimer. \n \nRedistributions in binary form must reproduce the above copyright   notice, \nthis list of conditions and the following disclaimer in the    documentation \nand/or other materials provided with the distribution. \n \nNeither the name of the Sun Microsystems, Inc. nor the names of its \ncontributors may be used to endorse or promote products derived from this \nsoftware without specific prior written permission. \n \nTHIS SOFTWARE IS PROVIDED BY THE COPYRIGHT HOLDERS AND CONTRIBUTORS ``AS IS'' \nAND ANY EXPRESS OR IMPLIED WARRANTIES, INCLUDING, BUT NOT LIMITED TO, THE \nIMPLIED WARRANTIES OF MERCHANTABILITY AND FITNESS FOR A PARTICULAR PURPOSE \nARE DISCLAIMED.  IN NO EVENT SHALL THE COPYRIGHT HOLDERS OR CONTRIBUTORS BE \nLIABLE FOR ANY DIRECT, INDIRECT, INCIDENTAL, SPECIAL, EXEMPLARY, OR \nCONSEQUENTIAL DAMAGES (INCLUDING, BUT NOT LIMITED TO, PROCUREMENT OF \nSUBSTITUTE GOODS OR SERVICES; LOSS OF USE, DATA, OR PROFITS; OR BUSINESS \nINTERRUPTION) HOWEVER CAUSED AND ON ANY THEORY OF LIABILITY, WHETHER IN \nCONTRACT, STRICT LIABILITY, OR TORT (INCLUDING NEGLIGENCE OR OTHERWISE) \nARISING IN ANY WAY OUT OF THE USE OF THIS SOFTWARE, EVEN IF ADVISED OF THE \nPOSSIBILITY OF SUCH DAMAGE. \n \n---- Part 5: Sparta, Inc copyright notice (BSD) ----- \n \nCopyright (c) 2003-2006, Sparta, Inc \nAll rights reserved. \n  \nRedistribution and use in source and binary forms, with or without \nmodification, are permitted provided that the following conditions are met: \n  \nRedistributions of source code must retain the above copyright notice,  this \nlist of conditions and the following disclaimer. \n  \nRedistributions in binary form must reproduce the above copyright   notice, \nthis list of conditions and the following disclaimer in the    documentation \nand/or other materials provided with the distribution. \n  \nNeither the name of Sparta, Inc nor the names of its contributors may  be \nused to endorse or promote products derived from this software    without \nspecific prior written permission. \n  \nTHIS SOFTWARE IS PROVIDED BY THE COPYRIGHT HOLDERS AND CONTRIBUTORS ``AS IS'' \nAND ANY EXPRESS OR IMPLIED WARRANTIES, INCLUDING, BUT NOT LIMITED TO, THE \nIMPLIED WARRANTIES OF MERCHANTABILITY AND FITNESS FOR A PARTICULAR PURPOSE \nARE DISCLAIMED.  IN NO EVENT SHALL THE COPYRIGHT HOLDERS OR CONTRIBUTORS BE \nLIABLE FOR ANY DIRECT, INDIRECT, INCIDENTAL, SPECIAL, EXEMPLARY, OR \nCONSEQUENTIAL DAMAGES (INCLUDING, BUT NOT LIMITED TO, PROCUREMENT OF \nSUBSTITUTE GOODS OR SERVICES; LOSS OF USE, DATA, OR PROFITS; OR BUSINESS \nINTERRUPTION) HOWEVER CAUSED AND ON ANY THEORY OF LIABILITY, WHETHER IN \nCONTRACT, STRICT LIABILITY, OR TORT (INCLUDING NEGLIGENCE OR OTHERWISE) \nARISING IN ANY WAY OUT OF THE USE OF THIS SOFTWARE, EVEN IF ADVISED OF THE \nPOSSIBILITY OF SUCH DAMAGE. \n \n---- Part 6: Cisco/BUPTNIC copyright notice (BSD) ----- \n \nCopyright (c) 2004, Cisco, Inc and Information Network Center of Beijing \nUniversity of Posts and Telecommunications. \nAll rights reserved. \n  \nRedistribution and use in source and binary forms, with or without \nmodification, are permitted provided that the following conditions are met: \n  \nRedistributions of source code must retain the above copyright notice, this \nlist of conditions and the following disclaimer. \n  \nRedistributions in binary form must reproduce the above copyright    notice, \nthis list of conditions and the following disclaimer in the   documentation \nand/or other materials provided with the distribution. \n  \nNeither the name of Cisco, Inc, Beijing University of Posts and \nTelecommunications, nor the names of their contributors may be used to \nendorse or promote products derived from this software without specific prior \nwritten permission. \n  \nTHIS SOFTWARE IS PROVIDED BY THE COPYRIGHT HOLDERS AND CONTRIBUTORS ``AS IS'' \nAND ANY EXPRESS OR IMPLIED WARRANTIES, INCLUDING, BUT NOT LIMITED TO, THE \nIMPLIED WARRANTIES OF MERCHANTABILITY AND FITNESS FOR A PARTICULAR PURPOSE \nARE DISCLAIMED.  IN NO EVENT SHALL THE COPYRIGHT HOLDERS OR CONTRIBUTORS BE \nLIABLE FOR ANY DIRECT, INDIRECT, INCIDENTAL, SPECIAL, EXEMPLARY, OR \nCONSEQUENTIAL DAMAGES (INCLUDING, BUT NOT LIMITED TO, PROCUREMENT OF \nSUBSTITUTE GOODS OR SERVICES; LOSS OF USE, DATA, OR PROFITS; OR BUSINESS \nINTERRUPTION) HOWEVER CAUSED AND ON ANY THEORY OF LIABILITY, WHETHER IN \nCONTRACT, STRICT LIABILITY, OR TORT (INCLUDING NEGLIGENCE OR OTHERWISE) \nARISING IN ANY WAY OUT OF THE USE OF THIS SOFTWARE, EVEN IF ADVISED OF THE \nPOSSIBILITY OF SUCH DAMAGE. \n \n---- Part 7: Fabasoft R&D Software GmbH & Co KG copyright notice (BSD) ----- \n \nCopyright (c) Fabasoft R&D Software GmbH & Co KG, 2003 \noss@fabasoft.com \nAuthor: Bernhard Penz  \n \nRedistribution and use in source and binary forms, with or without \nmodification, are permitted provided that the following conditions are met: \n  \nRedistributions of source code must retain the above copyright notice, this \nlist of conditions and the following disclaimer. \n  \nRedistributions in binary form must reproduce the above copyright    notice, \nthis list of conditions and the following disclaimer in the   documentation \nand/or other materials provided with the distribution. \n \nThe name of Fabasoft R&D Software GmbH & Co KG or any of its subsidiaries, \nbrand or product names may not be used to endorse or promote products derived \nfrom this software without specific prior written permission. \n \nTHIS SOFTWARE IS PROVIDED BY THE COPYRIGHT HOLDER ``AS IS'' AND ANY \nEXPRESS OR IMPLIED WARRANTIES, INCLUDING, BUT NOT LIMITED TO, THE \nIMPLIED WARRANTIES OF MERCHANTABILITY AND FITNESS FOR A PARTICULAR \nPURPOSE ARE DISCLAIMED.  IN NO EVENT SHALL THE COPYRIGHT HOLDER BE \nLIABLE FOR ANY DIRECT, INDIRECT, INCIDENTAL, SPECIAL, EXEMPLARY, OR \nCONSEQUENTIAL DAMAGES (INCLUDING, BUT NOT LIMITED TO, PROCUREMENT OF \nSUBSTITUTE GOODS OR SERVICES; LOSS OF USE, DATA, OR PROFITS; OR \nBUSINESS INTERRUPTION) HOWEVER CAUSED AND ON ANY THEORY OF LIABILITY, \nWHETHER IN CONTRACT, STRICT LIABILITY, OR TORT (INCLUDING NEGLIGENCE \nOR OTHERWISE) ARISING IN ANY WAY OUT OF THE USE OF THIS SOFTWARE, EVEN \nIF ADVISED OF THE POSSIBILITY OF SUCH DAMAGE."
}