{
  "key": "qpopper",
  "short_name": "Qpopper License",
  "name": "Qpopper License",
  "category": "Permissive",
  "owner": "Qualcomm",
  "homepage_url": "http://www.eudora.com/products/unsupported/qpopper/license.html",
  "spdx_license_key": "LicenseRef-scancode-qpopper",
  "text_urls": [
    "http://www.eudora.com/products/unsupported/qpopper/license.html"
  ],
  "ignorable_copyrights": [
    "(c) Copyright 1989-1991 The Regents of the University of California",
    "Copyright 1993-2006 QUALCOMM Incorporated"
  ],
  "ignorable_holders": [
    "QUALCOMM Incorporated",
    "The Regents of the University of California"
  ],
  "ignorable_authors": [
    "Austin Shelton, Information Systems and Technology, University of California, Berkeley"
  ],
  "text": "Qpopper(tm) is licensed by QUALCOMM Incorporated under the following\n    terms and conditions.  ANY USE OF QPOPPER CONSTITUTES AGREEMENT TO\n    THESE TERMS.\n\n1.  Warranty Disclaimer.  QPOPPER SOFTWARE IS PROVIDED TO THE USER \"AS\n    IS.\" QUALCOMM MAKES NO WARRANTIES, EITHER EXPRESS OR IMPLIED, WITH\n    RESPECT TO THE QPOPPER SOFTWARE AND/OR ASSOCIATED MATERIALS\n    PROVIDED TO THE USER, INCLUDING BUT NOT LIMITED TO ANY WARRANTY OF\n    MERCHANTABILITY, FITNESS FOR A PARTICULAR PURPOSE OR AGAINST\n    INFRINGEMENT.  QUALCOMM does not warrant that the functions\n    contained in the software will meet your requirements, or that the\n    operation of the software will be uninterrupted or error-free, or\n    that defects in the software will be corrected.  Furthermore,\n    QUALCOMM does not warrant or make any representations regarding\n    the use or the results of the use of the software or any\n    documentation provided therewith in terms of their correctness,\n    accuracy, reliability, or otherwise.  No oral or written\n    information or advice given by QUALCOMM or a QUALCOMM\n    representative shall create a warranty or in any way increase the\n    scope of this warranty.\n\n2.  Limitation of Liability.  QUALCOMM AND ITS LICENSORS ARE NOT LIABLE\n    FOR ANY CLAIMS OR DAMAGES WHATSOEVER ARISING IN CONNECTION WITH\n    THE QPOPPER SOFTWARE, INCLUDING WITHOUT LIMITATION PROPERTY\n    DAMAGE, PERSONAL INJURY, INTELLECTUAL PROPERTY INFRINGEMENT, LOSS\n    OF PROFITS, OR INTERRUPTION OF BUSINESS, OR FOR ANY SPECIAL,\n    CONSEQUENTIAL OR INCIDENTAL DAMAGES, HOWEVER CAUSED, WHETHER\n    ARISING OUT OF BREACH OF WARRANTY, CONTRACT, TORT (INCLUDING\n    NEGLIGENCE), STRICT LIABILITY, OR OTHERWISE.\n\n3.  Using and Distributing Qpopper.  If a party agrees to these terms\n    and conditions, such party may copy and use Qpopper for any\n    purpose, and distribute unmodified complete copies of Qpopper to\n    any third party provided that such third party must agree to these\n    terms and conditions prior to any use of Qpopper.  Failure to\n    include these license terms when distributing Qpopper shall be a\n    material breach of this agreement, and the party committing such\n    breach shall defend and indemnify QUALCOMM Incorporated against\n    all claims, losses, liabilities, damages, costs and expenses,\n    including attorney's fees, which QUALCOMM may incur in connection\n    with such breach.\n\n4.  Modifying Qpopper.  Qpopper consists of (i) intellectual property\n    owned by QUALCOMM Incorporated, and (ii) intellectual property\n    owned by the Regents of the University of California.  Any\n    modifications to the U.C.-owned portions of Qpopper are subject to\n    the provisions of Section 7 below.  A party to this agreement may\n    create derivative works of the QUALCOMM-owned portions of the\n    Qpopper software, distribute such derivative works to third\n    parties, and permit such third parties to copy and use such\n    derivative works subject to the following restrictions:\n   \n    (a)  The protocol greeting banner and the CAPA IMPLEMENTATION\n         response tag must include clear notification that Qpopper has\n         been modified (for example,\n         \"FooPopper-by-Foo-Networks-hacked-from-Qpopper-4.0\").\n   \n    (b)  Detailed notification of all modifications must be clearly and\n         conspicuously included within the modified source files, and\n         in a separate document.  All of the source files and the\n         document describing the changes must be distributed with the\n         modified software.\n   \n    (c)  When distributing the modified software the distributing party\n         must clearly and conspicuously communicate to all recipients\n         that the modified software is produced by the party that\n         modified the software and is not a QUALCOMM product.\n\n    (d)  The term \"Qpopper\" shall not be used in connection with the\n         modified software except in a purely factual manner when\n         describing the history or development of the software.\n\n    (e)  The modified software must be licensed to end users using a\n         license agreement which expressly states that portions of the\n         modified software are based on code owned by QUALCOMM\n         Incorporated, that such QUALCOMM code is only provided on the\n         terms stated in this agreement, and that QUALCOMM bears no\n         responsibility whatsoever for any modifications to the QUALCOMM\n         code.\n\n    (f)  The modifying party shall defend and indemnify QUALCOMM\n         Incorporated against all claims, losses, liabilities, damages,\n         costs and expenses, including attorney's fees, which QUALCOMM\n         may incur in connection with any intellectual property\n         infringement or similar claim related to the modified\n         software, if such claim is related to that party's\n         modifications.\n\n5.  Notices.  QUALCOMM is a registered trademark and registered service\n    mark of QUALCOMM Incorporated.  Qpopper is a trademark of QUALCOMM\n    Incorporated.  QUALCOMM does not grant any party the right to use\n    such marks on any modified version of the Qpopper software.  All\n    other trademarks and service marks are the property of their\n    respective owners.  The Qpopper software, excluding the portions\n    owned by the Regents of the University of California, is Copyright\n    1993-2006 QUALCOMM Incorporated.  All rights not expressly granted\n    herein are reserved by QUALCOMM.\n\n6.  General.  This agreement is governed and interpreted in accordance\n    with the laws of the State of California without giving effect to\n    its conflict of laws provisions.  Any claim arising out of or\n    related to this agreement must be brought exclusively in the state\n    or federal courts located in San Diego County, California.  The\n    United Nations Convention on Contracts for the International Sale\n    of Goods is expressly disclaimed.  If any provision of this\n    agreement shall be invalid, the validity of the  remaining\n    provisions of this agreement shall not be affected.  This\n    agreement is the entire and exclusive agreement between QUALCOMM\n    and any user of the Qpopper software with respect to the software\n    and supersedes all prior agreements (whether written or oral) and\n    other communications related to the software.\n\n7.  IMPORTANT.\n\n    This software program contains code, and/or derivatives or\n    modifications of code originating from the software program\n    \"Popper.\" Popper is (c) Copyright 1989-1991 The Regents of the\n    University of California, All Rights Reserved.  Popper was\n    created by Austin Shelton, Information Systems and Technology,\n    University of California, Berkeley.  Permission from the Regents of\n    the University of California to use, copy, modify, and distribute\n    the \"Popper\" software contained herein for any purpose, without\n    fee, and without a written agreement is hereby granted, provided\n    that the above copyright notice and this paragraph and the\n    following two paragraphs appear in all copies.  HOWEVER, ADDITIONAL\n    PERMISSIONS MAY BE NECESSARY FROM OTHER PERSONS OR ENTITIES, TO\n    USE DERIVATIVES OR MODIFICATIONS OF POPPER.\n\n    IN NO EVENT SHALL THE UNIVERSITY OF CALIFORNIA BE LIABLE TO ANY\n    PARTY FOR DIRECT, INDIRECT, SPECIAL, INCIDENTAL, OR CONSEQUENTIAL\n    DAMAGES, INCLUDING LOST PROFITS, ARISING OUT OF THE USE OF THE\n    POPPER SOFTWARE, OR ITS DERIVATIVES OR MODIFICATIONS, AND ITS\n    DOCUMENTATION, EVEN IF THE UNIVERSITY OF CALIFORNIA HAS BEEN\n    ADVISED OF THE POSSIBLITY OF SUCH DAMAGE.\n\n    THE UNIVERSITY OF CALIFORNIA, SPECIFICALLY DISCLAIMS ANY\n    WARRANTIES, INCLUDING, BUT NOT LIMITED TO, THE IMPLIED WARRANTIES\n    OF MERCHANTABILITY AND FITNESS FOR A PARTICULAR PURPOSE.  THE\n    POPPER SOFTWARE PROVIDED HEREUNDER IS ON AN \"AS IS\" BASIS, AND THE\n    UNIVERSITY OF CALIFORNIA HAS NO OBLIGATIONS TO PROVIDE\n    MAINTENANCE, SUPPORT, UPDATES, ENCHANCEMENTS, OR MODIFICATIONS.\n"
}