{
  "key": "ucl-1.0",
  "short_name": "UCL-1.0",
  "name": "Upstream Compatibility License v1.0",
  "category": "Copyleft Limited",
  "owner": "Lawrence Rosen",
  "homepage_url": "https://opensource.org/licenses/UCL-1.0",
  "spdx_license_key": "UCL-1.0",
  "text_urls": [
    "https://opensource.org/licenses/UCL-1.0"
  ],
  "osi_url": "https://opensource.org/licenses/UCL-1.0",
  "other_urls": [
    "https://github.com/spdx/license-list-XML/issues/894"
  ],
  "standard_notice": "Licensed under the Upstream Compatibility License 1.0",
  "ignorable_copyrights": [
    "Copyright (c) 2005 Lawrence Rosen",
    "Copyright (c) 2017 Nigel Tzeng"
  ],
  "ignorable_holders": [
    "Lawrence Rosen",
    "Nigel Tzeng"
  ],
  "text": "Upstream Compatibility License v. 1.0 (UCL-1.0)\n\nThis Upstream Compatibility License (the \"License\") applies to any\noriginal work of authorship (the \"Original Work\") whose owner (the\n\"Licensor\") has placed the following licensing notice adjacent to the\ncopyright notice for the Original Work:\n\nLicensed under the Upstream Compatibility License 1.0\n\n1) Grant of Copyright License.\n\nLicensor grants You a worldwide, royalty-free, non-exclusive,\nsublicensable license, for the duration of the copyright, to do the\nfollowing:\n\na) to reproduce the Original Work in copies, either alone or as part of\na collective work;\n\nb) to translate, adapt, alter, transform, modify, or arrange the\nOriginal Work, thereby creating derivative works (\"Derivative Works\")\nbased upon the Original Work;\n\nc) to distribute or communicate copies of the Original Work and\nDerivative Works to the public, with the proviso that copies of Original\nWork You distribute or communicate shall be licensed under this Upstream\nCompatibility License and all Derivative Work You distribute or\ncommunicate shall be licensed under both this Upstream Compatibility\nLicense and the Apache License 2.0 or later;\n\nd) to perform the Original Work publicly; and\n\ne) to display the Original Work publicly.\n\n2) Grant of Patent License.\n\nLicensor grants You a worldwide, royalty-free, non-exclusive,\nsublicensable license, under patent claims owned or controlled by the\nLicensor that are embodied in the Original Work as furnished by the\nLicensor, for the duration of the patents, to make, use, sell, offer for\nsale, have made, and import the Original Work and Derivative Works.\n\n3) Grant of Source Code License.\n\nThe term \"Source Code\" means the preferred form of the Original Work for\nmaking modifications to it and all available documentation describing\nhow to modify the Original Work. Licensor agrees to provide a machine-\nreadable copy of the Source Code of the Original Work along with each\ncopy of the Original Work that Licensor distributes. Licensor reserves\nthe right to satisfy this obligation by placing a machine-readable copy\nof the Source Code in an information repository reasonably calculated to\npermit inexpensive and convenient access by You for as long as Licensor\ncontinues to distribute the Original Work.\n\n4) Exclusions From License Grant.\n\nNeither the names of Licensor, nor the names of any contributors to the\nOriginal Work, nor any of their trademarks or service marks, may be used\nto endorse or promote products derived from this Original Work without\nexpress prior permission of the Licensor. Except as expressly stated\nherein, nothing in this License grants any license to Licensor's\ntrademarks, copyrights, patents, trade secrets or any other intellectual\nproperty. No patent license is granted to make, use, sell, offer for\nsale, have made, or import embodiments of any patent claims other than\nthe licensed claims defined in Section 2. No license is granted to the\ntrademarks of Licensor even if such marks are included in the Original\nWork. Nothing in this License shall be interpreted to prohibit Licensor\nfrom licensing under terms different from this License any Original Work\nthat Licensor otherwise would have a right to license.\n\n5) External Deployment.\n\nThe term \"External Deployment\" means the use, distribution, or\ncommunication of the Original Work or Derivative Works in any way such\nthat the Original Work or Derivative Works may be used by anyone other\nthan You, whether those works are distributed or communicated to those\npersons or made available as an application intended for use over a\nnetwork. As an express condition for the grants of license hereunder,\nYou must treat any External Deployment by You of the Original Work or a\nDerivative Work as a distribution under section 1(c).\n\n6) Attribution Rights.\n\nYou must retain, in the Source Code of any Derivative Works that You\ncreate, all copyright, patent, or trademark notices from the Source Code\nof the Original Work, as well as any notices of licensing and any\ndescriptive text identified therein as an \"Attribution Notice.\" You must\ncause the Source Code for any Derivative Works that You create to carry\na prominent Attribution Notice reasonably calculated to inform\nrecipients that You have modified the Original Work.\n\n7) Warranty of Provenance and Disclaimer of Warranty.\n\nLicensor warrants that the copyright in and to the Original Work and the\npatent rights granted herein by Licensor are owned by the Licensor or\nare sublicensed to You under the terms of this License with the\npermission of the contributor(s) of those copyrights and patent rights.\nExcept as expressly stated in the immediately preceding sentence, the\nOriginal Work is provided under this License on an \"AS IS\" BASIS and\nWITHOUT WARRANTY, either express or implied, including, without\nlimitation, the warranties of non-infringement, merchantability or\nfitness for a particular purpose. THE ENTIRE RISK AS TO THE QUALITY OF\nTHE ORIGINAL WORK IS WITH YOU. This DISCLAIMER OF WARRANTY constitutes\nan essential part of this License. No license to the Original Work is\ngranted by this License except under this disclaimer.\n\n8) Limitation of Liability.\n\nUnder no circumstances and under no legal theory, whether in tort\n(including negligence), contract, or otherwise, shall the Licensor be\nliable to anyone for any indirect, special, incidental, or consequential\ndamages of any character arising as a result of this License or the use\nof the Original Work including, without limitation, damages for loss of\ngoodwill, work stoppage, computer failure or malfunction, or any and all\nother commercial damages or losses. This limitation of liability shall\nnot apply to the extent applicable law prohibits such limitation.\n\n9) Acceptance and Termination.\n\nIf, at any time, You expressly assented to this License, that assent\nindicates your clear and irrevocable acceptance of this License and all\nof its terms and conditions. If You distribute or communicate copies of\nthe Original Work or a Derivative Work, You must make a reasonable\neffort under the circumstances to obtain the express assent of\nrecipients to the terms of this License. This License conditions your\nrights to undertake the activities listed in Section 1, including your\nright to create Derivative Works based upon the Original Work, and doing\nso without honoring these terms and conditions is prohibited by\ncopyright law and international treaty. Nothing in this License is\nintended to affect copyright exceptions and limitations (including \"fair\nuse\" or \"fair dealing\"). This License shall terminate immediately and\nYou may no longer exercise any of the rights granted to You by this\nLicense upon your failure to honor the conditions in Section 1(c).\n\n10) Termination for Patent Action.\n\nThis License shall terminate automatically and You may no longer\nexercise any of the rights granted to You by this License as of the date\nYou commence an action, including a cross-claim or counterclaim, against\nLicensor or any licensee alleging that the Original Work infringes a\npatent. This termination provision shall not apply for an action\nalleging patent infringement by combinations of the Original Work with\nother software or hardware.\n\n11) Jurisdiction, Venue and Governing Law.\n\nAny action or suit relating to this License may be brought only in the\ncourts of a jurisdiction wherein the Licensor resides or in which\nLicensor conducts its primary business, and under the laws of that\njurisdiction excluding its conflict-of-law provisions. The application\nof the United Nations Convention on Contracts for the International Sale\nof Goods is expressly excluded. Any use of the Original Work outside the\nscope of this License or after its termination shall be subject to the\nrequirements and penalties of copyright or patent law in the appropriate\njurisdiction. This section shall survive the termination of this\nLicense.\n\n12) Attorneys' Fees.\n\nIn any action to enforce the terms of this License or seeking damages\nrelating thereto, the prevailing party shall be entitled to recover its\ncosts and expenses, including, without limitation, reasonable attorneys'\nfees and costs incurred in connection with such action, including any\nappeal of such action. This section shall survive the termination of\nthis License.\n\n13) Miscellaneous.\n\nIf any provision of this License is held to be unenforceable, such\nprovision shall be reformed only to the extent necessary to make it\nenforceable.\n\n14) Definition of \"You\" in This License.\n\n\"You\" throughout this License, whether in upper or lower case, means an\nindividual or a legal entity exercising rights under, and complying with\nall of the terms of, this License. For legal entities, \"You\" includes\nany entity that controls, is controlled by, or is under common control\nwith you. For purposes of this definition, \"control\" means (i) the\npower, direct or indirect, to cause the direction or management of such\nentity, whether by contract or otherwise, or (ii) ownership of fifty\npercent (50%) or more of the outstanding shares, or (iii) beneficial\nownership of such entity.\n\n15) Right to Use.\n\nYou may use the Original Work in all ways not otherwise restricted or\nconditioned by this License or by law, and Licensor promises not to\ninterfere with or be responsible for such uses by You.\n\n16) Modification of This License.\n\nThis License is Copyright (c) 2005 Lawrence Rosen and Copyright (c) 2017\nNigel Tzeng. Permission is granted to copy, distribute, or communicate\nthis License without modification. Nothing in this License permits You\nto modify this License as applied to the Original Work or to Derivative\nWorks. However, You may modify the text of this License and copy,\ndistribute or communicate your modified version (the \"Modified License\")\nand apply it to other original works of authorship subject to the\nfollowing conditions: (i) You may not indicate in any way that your\nModified License is the \"Open Software License\" or \"OSL\" or the\n\"Upstream Compatibility License\" or \"UCL\" and you may not use those\nnames in the name of your Modified License; (ii) You must replace the\nnotice specified in the first paragraph above with the notice \"Licensed\nunder \" or with a notice of your own that is not confusingly similar to\nthe notice in this License; and (iii) You may not claim that your\noriginal works are open source software unless your Modified License has\nbeen approved by Open Source Initiative (OSI) and You comply with its\nlicense review and certification process."
}